image_name	description	category	author	genre
"The Four Bad Boys and Me by Tina Lata.jpg"	"A thrilling romance about four bad boys..."	Romance	Tina Lata	Romance
"Daddy Material by Oikawa Tooru.jpg"	"A lighthearted romantic comedy..."	Fiction	Oikawa Tooru	Romance
"Throne of Glass by Sarah J. Maas.jpg"	"A gripping fantasy novel about power and magic."	Fantasy	Sarah J. Maas	Fantasy
"The Silent Patient by Alex Michaelides.jpg"	"A psychological thriller with a twisted ending."	Thriller	Alex Michaelides	Thriller
"The Hunger Games by Suzanne Collins.jpg"	"A dystopian adventure about survival."	Adventure	Suzanne Collins	Adventure
"Invisible Armies by Jon Evans.jpg"	"A military thriller set in a modern battlefield."	Thriller	Jon Evans	Thriller
"Ocean Blue by Olivia Vaughn.jpg"	"A beautiful romantic story by the sea..."	Romance	Olivia Vaughn	Romance
"A Court of Thorns and Roses by Sarah J. Maas.jpg"	"A fantasy novel filled with magic and mystery."	Fantasy	Sarah J. Maas	Fantasy